,Title,Desc,Type,BodyPart,Equipment,Level,Rating,RatingDesc
703,Band standing concentration curl,"The band standing concentration curl is a variation of a popular biceps-focused exercise utilizing a band instead of a dumbbell. It allows you to focus on one biceps at a time and really squeeze out intense peak contractions. Band concentration curls are usually performed for moderate to high reps, such as 8-12 reps per set or more, as part of an upper-body or arm-focused workout.",Strength,Biceps,Bands,Intermediate,,
704,Brachialis SMR,"Brachialis self-myofascial release (SMR) is a self-administered soft-tissue treatment for the upper body, usually using a foam roller, lacrosse ball, or other ""trigger point"" massage tool. By applying pressure strategically to the biceps or brachialis muscles of the upper arm, some people find they can cause this often painful and tight muscle to relax or ""release."" Brachialis SMR is often accompanied by SMR on the triceps muscles or pectorals, or by stretches that target the biceps or pecs.",Stretching,Biceps,Foam Roll,Beginner,3.2,Average
705,Wide-grip barbell curl,"The wide-grip barbell curl is a variation of the classic barbell curl with the grip wider than shoulder width. It is thought that this helps build the inner or ""short"" head of the biceps muscles. This movement is usually performed for moderate to high reps, such as 8-12 reps per set.",Strength,Biceps,Barbell,Beginner,9.3,Average
706,EZ-bar spider curl,"The EZ-bar spider curl is an exercise targeting the biceps and performed face down on either an incline bench or on the flat side of a preacher bench. The EZ-bar makes for a more comfortable wrist position, while the angle helps to isolate the biceps and limit involvement of the shoulder muscles. This curl variation is usually performed for moderate to high reps, such as 8-12 reps per set or more, as part of upper-body or arm-focused training.",Strength,Biceps,Barbell,Intermediate,9.2,Average
707,Barbell Curl,"The barbell curl is an arm exercise that is also one of the most recognizable movements in all of bodybuilding and fitness. It helps build sleeve-popping biceps and allows heavier loading than many other curl variations. It is usually performed in moderate to high reps, such as 8-12 reps per set, as part of the arm-focused portion of any workout.",Strength,Biceps,Barbell,Intermediate,9.0,Average
708,Close-grip EZ-bar curl,"The close-grip EZ-bar curl is an exercise targeting the biceps, particularly the long head. The main difference between this exercise and standard EZ-bar curls is that the hands are positioned closer together on the bar. It is thought that this helps build the outer biceps head and the peak. This curl variation is usually performed for moderate to high reps, such as 8-12 reps per set.",Strength,Biceps,Barbell,Beginner,8.9,Average
709,Preacher Curl,"The EZ-bar preacher curl is a classic exercise for building bigger biceps. This move is all about isolation. With the back of the upper arms against the pad, it’s next to impossible to cheat. Go light, get a great pump, and build that peak!",Strength,Biceps,Barbell,Intermediate,8.8,Average
710,Barbell Curls Lying Against An Incline,,Strength,Biceps,Barbell,Beginner,8.8,Average
711,Seated Close-Grip Concentration Barbell Curl,,Strength,Biceps,Barbell,Beginner,8.8,Average
712,Close-grip barbell curl,"The close-grip barbell curl is a curl variation where the hands are closer than shoulder width. It is thought that this helps build the outer biceps head and the peak. This curl variation is usually performed for moderate to high reps, such as 8-12 reps per set.",Strength,Biceps,Barbell,Beginner,8.6,Average
713,Drag curl,"The drag curl is a biceps exercise that attempts to remove the influence of the front deltoids on the classic curl. With the elbows kept back, the barbell ""drags"" up the torso. It is usually performed for moderate to high reps, such as 8-15 reps per set, as part of an upper-body or arms-focused workout.",Strength,Biceps,Barbell,Beginner,8.5,Average
714,Reverse-grip barbell curl,"The reverse-grip barbell curl is a variation on the biceps curl where the palms face downward. The switch from an underhand to an overhand grip brings the forearm and brachialis muscles more into the exercise. If it is uncomfortable to the wrists, try performing it on the angles of an EZ-curl bar.",Strength,Biceps,Barbell,Intermediate,8.2,Average
715,Lying High Bench Barbell Curl,,Strength,Biceps,Barbell,Beginner,5.8,Average
716,Seated wide-grip curl to close-grip curl,"The seated wide-grip curl to close-grip curl is a variation on the classic seated dumbbell curl. It is thought that wide-grip curls target the inner head of the biceps more, while close-grip curls target the outer head or peak. This variation allows you to get the benefits of both.",Strength,Biceps,Barbell,Beginner,0.0,
717,Seated Straigh-Bar Curl Superset,"The seated wide-grip curl to close-grip curl is a variation on the classic seated dumbbell curl. The variation is that the range of motion changes in alternating fashion—one more traditional, one where you’re bringing the weight in more from the side.",Strength,Biceps,Barbell,Beginner,0.0,
718,Dave Draper Forehead Curl,,Strength,Biceps,Barbell,Intermediate,,
719,Reverse-grip EZ-bar curl,"The reverse-grip EZ-bar curl is an exercise targeting the biceps and forearms. Because grip strength is a limitation with this move, it is often performed for moderate to high reps as part of an upper-body or arm-focused workout.",Strength,Biceps,Barbell,Intermediate,,
720,EZ-Bar Spider Curl - Gethin Variation,The EZ-bar spider curl is an isolation exercise targeting the biceps and performed face-down on an incline bench. The EZ-bar makes for a more comfortable wrist position.,Strength,Biceps,Barbell,Intermediate,,
721,Barbell curl-,"The barbell curl is an arm exercise that is also one of the most recognizable movements in all of bodybuilding and fitness. It helps build sleeve-popping biceps and allows heavier loading than many other curl variations. It is usually performed in moderate to high reps, such as 8-12 reps per set, as part of the arm-focused portion of any workout.",Strength,Biceps,Barbell,Intermediate,,
722,Paul Carter Barbell Curl,"The barbell curl is an arm exercise that is also one of the most recognizable movements in all of bodybuilding and fitness. It helps build sleeve-popping biceps and allows heavier loading than many other curl variations. It is usually performed in moderate to high reps, such as 8-12 reps per set, as part of the arm-focused portion of any workout.",Strength,Biceps,Barbell,Intermediate,,
723,Standing band biceps curl,The standing band biceps curl is an arm-focused exercise using a band for resistance. This variation is usually performed for moderate to high reps as part of an arms-focused or upper-body workout.,Strength,Biceps,Barbell,Intermediate,,
724,Close-Grip EZ-Bar Curl - Gethin Variation,"The close-grip EZ-bar curl is an exercise targeting the biceps, particularly the long head. The main difference between this exercise and standard barbell curls is that the hands are positioned closer together on the bar. It is thought that this helps build the outer biceps head and the peak. This curl variation is usually performed for moderate to high reps, like at least 8-12 reps per set.",Strength,Biceps,Barbell,Intermediate,,
725,Seated Barbell Curl,,Strength,Biceps,Barbell,Intermediate,,
726,AM Standing Barbell Curl,"The standing EZ-bar curl is an immenselyp popular exercise targeting the biceps. It is commonly performed for moderate to high reps as part of an upper body or arms-focused workout. Many gyms even have EZ-bars at fixed weights, allowing for easy weight changes.",Strength,Biceps,Barbell,Intermediate,,
727,EZ-bar preacher curl,"The EZ-bar preacher curl is a classic exercise for building bigger biceps. This move is all about isolation. With the back of the upper arms against the pad, it's next to impossible to use momentum which forces the muscles to work harder.",Strength,Biceps,Barbell,Intermediate,,
728,30 Arms Standing Barbell Curl,,Strength,Biceps,Barbell,Intermediate,,
729,30 Arms Incline Biceps Curl,,Strength,Biceps,Barbell,Intermediate,,
730,"Bicep Curls ""21s""",,Strength,Biceps,Barbell,Intermediate,,
731,Incline Hammer Curls,,Strength,Biceps,Dumbbell,Beginner,9.5,Average
732,Hammer Curls,"This curl is performed simultaneously with dumbbells but without wrist supination. Throughout each rep, the wrists remain neutral, like a carpenter hammering a nail.",Strength,Biceps,Dumbbell,Intermediate,9.1,Average
733,Biceps curl to shoulder press,"The biceps curl to shoulder press is a dumbbell complex that combines two exercises that build and strengthen the biceps and shoulders or deltoids. It is usually performed one rep of each movement at a time, although you could perform more reps of each, or increase the reps in successive rounds (e.g., 1 rep in round 1, 2 reps in round 2, etc.). No matter how you structure the sets and reps, it is a time-efficient way to hit two crucial upper-body muscles in any workout.",Strength,Biceps,Dumbbell,Beginner,9.1,Average
734,Concentration curl,"The concentration curl is a classic exercise for building the biceps one arm at a time. It can be performed bent over or kneeling, but is more often performed seated on a bench. It's great for emphasizing the biceps peak and is often used to finish a biceps workout. Like most curl variations, these are usually performed for moderate to high reps, such as 8-12 reps per set or more.",Strength,Biceps,Dumbbell,Intermediate,9.0,Average
735,Flexor Incline Dumbbell Curls,,Strength,Biceps,Dumbbell,Beginner,9.0,Average
736,Dumbbell Bicep Curl,"The dumbbell biceps curl is a single-joint exercise for building bigger and stronger biceps. Popular among gym goers of all experience levels, this move can be done seated or standing. It is generally performed for moderate to high reps, such as 8-12 reps or higher, as part of the arm-focused portion of a workout.",Strength,Biceps,Dumbbell,Intermediate,8.9,Average
737,Cross-body hammer curl,"The cross-body hammer curl is a dumbbell exercise that targets the biceps, brachialis, and forearm muscles. Rather than lifting the weights directly in front of the body, you lift them across the torso. Throughout each rep, the wrists remain neutral, like a carpenter hammering a nail. This helps isolate the brachialis muscles on each arm. It is generally performed for moderate to high reps, such as 8-12 reps or more, as part of the arm-focused portion of a workout.",Strength,Biceps,Dumbbell,Beginner,8.9,Average
738,Dumbbell Alternate Bicep Curl,"The alternating biceps curl is a single-joint exercise for building bigger and stronger biceps one arm at a time. Popular among gym goers of all experience levels, this move can be done seated or standing. It is generally performed for moderate to high reps, such as 8-12 reps or higher, as part of the arm-focused portion of a workout.",Strength,Biceps,Dumbbell,Intermediate,8.7,Average
739,Single-arm dumbbell preacher curl,"The single-arm dumbbell preacher curl is an exercise that focuses on building the biceps, particularly the biceps peak. Most people will go light on this movement, performing it for moderate to high reps as part of an upper-body or arms-focused workout.",Strength,Biceps,Dumbbell,Intermediate,8.7,Average
740,Alternate Incline Dumbbell Curl,"The alternating incline dumbbell biceps curl is an exercise targeting the biceps and performed face up on an incline bench. This creates a vertical arm angle which helps to isolate the biceps and limit involvement of the shoulder muscles. This curl variation is usually performed for moderate to high reps, such as 8-12 rep per arm or more, as part of upper-body or arm-focused training.",Strength,Biceps,Dumbbell,Intermediate,8.7,Average
741,Standing concentration curl,"The standing concentration curl is a variation on the more common seated concentration curl, which is a staple of bodybuilding arm routines. It can serve as a substitute for preacher curl variations if a preacher bench is unavailable and is also a classic way to focus in on the biceps peak. It is usually performed for moderate to high reps, such as 8-10 reps per set, with a focus on strict form and controlled tempo.",Strength,Biceps,Dumbbell,Beginner,8.7,Average
742,Alternating incline dumbbell biceps curl,"The alternating incline dumbbell biceps curl is an exercise targeting the biceps and performed face up on an incline bench. This creates a vertical arm angle which helps to isolate the biceps and limit involvement of the shoulder muscles. This curl variation is usually performed for moderate to high reps, such as 8-12 rep per arm or more, as part of upper-body or arm-focused training.",Strength,Biceps,Dumbbell,Intermediate,8.6,Average
743,Alternate Hammer Curl,"The alternating hammer curl is performed with dumbbells but without wrist supination. Throughout each rep, the wrists remain neutral, like a carpenter hammering a nail.",Strength,Biceps,Dumbbell,Intermediate,8.6,Average
744,Seated dumbbell biceps curl,"The seated dumbbell biceps curl is a popular exercise for building bigger biceps. While curls can effectively be performed standing as well, performing them seated can enforce strict form and perhaps boost the mind-muscle connection. Like most curl variations, these are usually performed for moderate to high reps, such as 8-12 reps per set or more.",Strength,Biceps,Dumbbell,Intermediate,8.6,Average
745,Preacher Hammer Dumbbell Curl,,Strength,Biceps,Dumbbell,Beginner,8.6,Average
746,Dumbbell preacher curl,"The dumbbell preacher curl is an exercise that focuses on building the biceps, particularly the biceps peak. All you need is a pair of dumbbells and a preacher bench. It's usually performed for moderate to high reps as part of an upper-body or arms-focused workout.",Strength,Biceps,Dumbbell,Intermediate,8.3,Average
747,Lying Supine Dumbbell Curl,,Strength,Biceps,Dumbbell,Beginner,8.3,Average
748,Standing Dumbbell Reverse Curl,"With the reverse-grip dumbbell curl, the palms face down, not up. This unorthodox wrist position simultaneously targets the biceps while also building forearm and grip strength. The move can performed standing or seated.",Strength,Biceps,Dumbbell,Beginner,8.1,Average
749,Palms-out incline biceps curl,"The palms-out incline biceps curl is an exercise targeting the biceps. It is largely similar to the incline dumbbell curl, but the palms-out position targets the long head of the biceps, which is responsible for the biceps ""peak."" This curl variation is usually performed for moderate to high reps, such as 8-12 reps per set or more, as part of upper-body or arm-focused training.",Strength,Biceps,Dumbbell,Beginner,8.0,Average
750,Straight-arm plank with biceps curl,"The straight-arm plank with biceps curl is a hybrid movement that trains the abdominal and biceps muscles simultaneously. It can address multiple muscle groups in a time-efficient muscle-building or circuit-style workout, while also providing an additional cardiovascular challenge.",Strength,Biceps,Dumbbell,Beginner,7.7,Average
751,Face-down incline dumbbell biceps curl,"The face-down incline dumbbell biceps curl is an exercise targeting the biceps and performed face down on an incline bench. This creates a vertical arm angle, which helps to isolate the biceps and limit involvement of the shoulder muscles. This curl variation is usually performed for moderate to high reps, such as 8-12 reps per set or more, as part of upper-body or arm-focused training.",Strength,Biceps,Dumbbell,Beginner,7.6,Average
752,Seated Dumbbell Inner Biceps Curl,,Strength,Biceps,Dumbbell,Beginner,7.4,Average
753,Standing Inner-Biceps Curl,,Strength,Biceps,Dumbbell,Beginner,7.4,Average
754,Seated hammer curl,"The seated hammer curl is a popular exercise for building bigger biceps and forearms. The movement resembles hammering a nail—hence the name. While curls can effectively be performed standing as well, performing them seated can enforce strict form and perhaps boost the mind-muscle connection. Like most curl variations, these are usually performed for moderate to high reps, such as 8-12 reps per set or more.",Strength,Biceps,Dumbbell,Intermediate,,
755,Paul Carter Incline Dumbbell Biceps Curl,The incline dumbbell biceps curl is an isolation exercise targeting the biceps. This variation targets the long head of the biceps more than a traditional curl and there is more overall tension to this muscle.,Strength,Biceps,Dumbbell,Intermediate,,
756,Paul Carter Concentration Curl,"The concentration curl is a classic exercise for building the biceps one arm at a time. It can be performed bent over or kneeling, but is more often performed seated on a bench. It's great for emphasizing the biceps peak and is often used to finish a biceps workout. Like most curl variations, these are usually performed for moderate to high reps, such as 8-12 reps per set or more.",Strength,Biceps,Dumbbell,Intermediate,,
757,FYR Dumbbell Curl,"The dumbbell biceps curl is a single-joint exercise for building bigger and stronger biceps. Popular among gym goers of all experience levels, this move can be done seated or standing. It is generally performed for moderate to high reps, such as 8-12 reps or higher, as part of the arm-focused portion of a workout.",Strength,Biceps,Dumbbell,Intermediate,,
758,Dumbbell biceps curl to upright row,"The dumbbell biceps curl to upright row is a dumbbell complex that combines two exercises that build and strengthen the biceps, traps, and the middle head of the deltoids. It is usually performed one rep of each movement at a time, although you could perform more reps of each, or increase the reps in successive rounds (e.g., 1 rep in round 1, 2 reps in round 2, etc.). No matter how you structure the sets and reps, it is a time-efficient way to hit multiple upper-body muscles in any workout.",Strength,Biceps,Dumbbell,Intermediate,,
759,FYR Dumbbell Hammer Curl,"This curl is performed simultaneously with dumbbells but without wrist supination. Throughout each rep, the wrists remain neutral, like a carpenter hammering a nail.",Strength,Biceps,Dumbbell,Intermediate,,
760,Dumbbell overhead hold with single-arm curl,"The dumbbell overhead hold with single-arm curl combines an isometric overhead hold with a curl for the other arm. The two movements collectively target the muscles of the shoulders and arms, while providing a surprising core challenge. Expect to be challenged, even with light weight.",Strength,Biceps,Dumbbell,Intermediate,,
761,FYR Kneeling Biceps,The kneeling concentration curl allows you to target the biceps without having the ability to use momentum from the rest of your body to move the weight.,Strength,Biceps,Dumbbell,Intermediate,,
762,Lunge hold dumbbell curl,"The lunge hold dumbbell curl is a challenging complex that combines an isometric hold at the bottom of a lunge with a dumbbell biceps curl. The two exercises combine to target the legs, core, and biceps. The curl will determine the amount of weight you can use, but even a light weight will make the lunge hold seriously challenging.",Strength,Biceps,Dumbbell,Intermediate,,
763,FYR Dumbbell Biceps Curl,"The dumbbell biceps curl is a single-joint exercise for building bigger and stronger biceps. Popular among gym goers of all experience levels, this move can be done seated or standing. It is generally performed for moderate to high reps, such as 8-12 reps or higher, as part of the arm-focused portion of a workout.",Strength,Biceps,Dumbbell,Intermediate,,
764,Alternating dumbbell snatch,"The alternating dumbbell snatch is an explosive exercise that builds full-body power and targets the muscles of the hips, back, and shoulders. Performing it by alternating arms gives each arm the chance to recover, allowing you to do a greater amount of quality work. It can be performed for low reps with a focus on power and speed, or for higher reps to build muscle or as part of a metabolic conditioning circuit.",Strength,Biceps,Dumbbell,Intermediate,,
765,TBS Incline Dumbbell Curl,The incline dumbbell biceps curl is an isolation exercise targeting the biceps. This variation targets the long head of the biceps more than a traditional curl and there is more overall tension to this muscle.,Strength,Biceps,Dumbbell,Intermediate,,
766,TBS Hammer Curl,"The alternating hammer curl is performed with dumbbells but without wrist supination. Throughout each rep, the wrists remain neutral, like a carpenter hammering a nail.",Strength,Biceps,Dumbbell,Intermediate,,
767,Reverse-grip dumbbell curl,"With the reverse-grip dumbbell curl, the palms face down, not up. This unorthodox wrist position simultaneously targets the biceps while also building forearm and grip strength. The move can be performed standing or seated. Because grip is a limiting factor, it is usually performed for moderate to high reps, such as 8-10 reps per set.",Strength,Biceps,Dumbbell,Intermediate,,
768,Incline Dumbbell Curl - Gethin Variation,The incline dumbbell biceps curl is an isolation exercise targeting the biceps. This variation targets the long head of the biceps more than a traditional curl and there is more overall tension to this muscle.,Strength,Biceps,Dumbbell,Intermediate,,
769,Hammer curl,"The hammer curl is a dumbbell movement that focuses on the biceps, brachialis, and forearm muscles. Throughout each rep, the wrists remain neutral, like a carpenter hammering a nail. It is generally performed for moderate to high reps, such as 8-12 reps or more, as part of the arm-focused portion of a workout.",Strength,Biceps,Dumbbell,Intermediate,,
770,Seated Dumbbell Curl - Gethin Variation,"The seated dumbbell biceps curl is a standard exercise for building bigger biceps. While dumbbell biceps curls can be performed standing, this version involves sitting on a bench.",Strength,Biceps,Dumbbell,Intermediate,,
771,Dumbbell Hammer Curl - Gethin Variation,"This curl is performed simultaneously with dumbbells but without wrist supination. Throughout each rep, the wrists remain neutral, like a carpenter hammering a nail.",Strength,Biceps,Dumbbell,Intermediate,,
772,Single-arm seated dumbbell curl,"The single-arm seated dumbbell curl is a popular exercise for building bigger biceps. Performing it one arm at a time may allow you to use slightly heavier weight, while focusing on really feeling the mind-muscle connection in the working arm. Like most curl variations, these are usually performed for moderate to high reps, such as 8-12 reps per set or more.",Strength,Biceps,Dumbbell,Intermediate,,
773,Lying Cable Curl - Gethin Variation,The lying cable biceps curl is an isolation exercise that eliminates the possibility of using momentum from the lower body to raise the weight.,Strength,Biceps,Dumbbell,Intermediate,,
774,Dumbbell biceps curl,"The dumbbell biceps curl is a single-joint exercise for building bigger and stronger biceps. Popular among gym goers of all experience levels, this move can be done seated or standing. It is generally performed for moderate to high reps, such as 8-12 reps or higher, as part of the arm-focused portion of a workout.",Strength,Biceps,Dumbbell,Intermediate,,
775,Seated Biceps Hammer Curl,,Strength,Biceps,Dumbbell,Intermediate,,
776,HM Alternating Reverse Lunge With Biceps Curl,,Strength,Biceps,Dumbbell,Intermediate,,
777,AM Hammer Curls,"This curl is performed simultaneously with dumbbells but without wrist supination. Throughout each rep, the wrists remain neutral, like a carpenter hammering a nail.",Strength,Biceps,Dumbbell,Intermediate,,
778,AM Seated Hammer Curls,"The seated hammer curl is a popular exercise for building bigger biceps. The movement resembles hammering a nail—hence the name. While hammer can be performed standing, this version involves sitting on a bench.",Strength,Biceps,Dumbbell,Intermediate,,
779,Seated alternating biceps curl,"The seated alternating biceps curl is an exercise that builds bigger and stronger biceps. The alternating technique allows one arm to rest briefly while the other arm lifts. It is usually performed for moderate to high reps, such as 8-12 reps or more, as part of the upper-body or arm-focused portion of a workout.",Strength,Biceps,Dumbbell,Intermediate,,
780,Alternating hammer curl,"The alternating hammer curl is performed with dumbbells but without wrist supination. Throughout each rep, the wrists remain neutral, like a carpenter hammering a nail. It is generally performed for moderate to high reps, such as 8-12 reps or more, as part of the arm-focused portion of a workout.",Strength,Biceps,Dumbbell,Intermediate,,
781,Alternating biceps curl,"The alternating biceps curl is a single-joint exercise for building bigger and stronger biceps one arm at a time. Popular among gym goers of all experience levels, this move can be done seated or standing. It is generally performed for moderate to high reps, such as 8-12 reps or higher, as part of the arm-focused portion of a workout.",Strength,Biceps,Dumbbell,Intermediate,,
782,Holman Slow Biceps Curl,,Strength,Biceps,Dumbbell,Intermediate,,
783,Holman Biceps Curl to Chest Punch,,Strength,Biceps,Dumbbell,Intermediate,,
784,Holman Right Arm Heavy Biceps Curl,,Strength,Biceps,Dumbbell,Intermediate,,
785,Holman Left Arm Heavy Biceps Curl,,Strength,Biceps,Dumbbell,Intermediate,,
786,Holman Alternating Front Lunge Biceps Curl,,Strength,Biceps,Dumbbell,Intermediate,,
787,Holman Weighted Double-Time Biceps Curl,,Strength,Biceps,Dumbbell,Intermediate,,
788,Holman Heavy Right Arm Biceps Curl,,Strength,Biceps,Dumbbell,Intermediate,,
789,Holman Heavy Left Arm Biceps Curl,,Strength,Biceps,Dumbbell,Intermediate,,
790,MetaBurn Dumbbell Drag Curl,,Strength,Biceps,Dumbbell,Intermediate,,
