,Title,Desc,Type,BodyPart,Equipment,Level,Rating,RatingDesc
2203,FYR Running Lunge,"The running lunge is a dynamic exercise that targets the lower body. It combines elements of a reverse lunge with a step-up, in that the front leg fully extends and the rear leg flexes up in front of the body. It targets a wide range of muscles in the lower body, including the quads, glutes, and hamstrings. It can be performed for time or reps in any lower-body workout, or in a fat-loss or athleticism-focused circuit.",Strength,Quadriceps,Body Only,Intermediate,,
2204,FYR Jumping Lunge,"The alternating lunge jump is an explosive bodyweight exercise that targets the lower-body muscles, including the quads, glutes, and hamstrings. It can be performed for time or reps in power training, and is also effective in any fat-loss or athleticism-focused workout.",Strength,Quadriceps,Body Only,Intermediate,,
2205,FYR Sprawl Frog Kick,"The sprawl frog kick is an explosive bodyweight exercise that targets multiple muscle groups across the upper and lower body. It is similar to a traditional sprawl, but with an extra hop in the middle of each rep. It can be performed for time or reps in any fat-loss or athleticism-focused circuit or workout.",Strength,Quadriceps,Body Only,Intermediate,,
2206,Jump squat-,"The jump squat is an explosive bodyweight exercise targeting the quads, hamstrings, and glutes. It is also a serious cardiovascular challenge when done for reps. It can be performed as a power exercise to build jumping power, or in any fat-loss or athleticism-focused workout.",Strength,Quadriceps,Body Only,Intermediate,,
2207,FYR Sprinter Burpee,,Cardio,Quadriceps,Body Only,Intermediate,,
2208,Single-leg burpee,"The single-leg burpee is an advanced variation of the burpee exercise that involves performing all parts of the sequence with one leg at a time. It is usually performed alternating legs with each rep, but could be performed one side at a time. Performing one leg at a time increases the challenge to all parts of the body, especially the working leg, core, and shoulders.",Strength,Quadriceps,Body Only,Intermediate,,
2209,FYR Gorilla Squat,"The gorilla squat is a bodyweight sequence that combines two reverse lunges and a bodyweight squat. It could also be performed with dumbbells, kettlebells, or other weights. It targets most of the muscles of the lower body, including the quads, glutes, and hamstrings. It can be performed for time or reps in the lower-body portion of any workout.",Strength,Quadriceps,Body Only,Intermediate,,
2210,Banded compass jump squat,"The banded compass jump squat is an explosive squat variation performed with a band around the thighs just above the knees. This increases muscle activation in the hips and glutes, while the squat targets the quads, hamstrings, and glutes. The landing for each jump is a 90-degree rotation from the starting position. The banded compass jump squat can be performed for low reps as a power-focused exercise, or for higher reps to build muscle in the lower body, challenge conditioning, and burn fat.",Strength,Quadriceps,Body Only,Intermediate,,
2211,In-out sprawl,"The in-out sprawl is a full-body movement that combines elements of a plank and a sprawl. It demands an explosive full-body jump from a plank position. It is a challenging move that trains balance, core strength, and many muscle groups, making it work well in a time-efficient bodyweight circuit workout.",Strength,Quadriceps,Body Only,Intermediate,,
2212,Knee-tuck kick-up,"The knee-tuck kick-up is a bodyweight movement that targets the muscles of the abs, the rectus abdominis or ""six-pack"" muscles in particular. It can be performed for time or reps in the ab-focused portion of any workout.",Strength,Quadriceps,Body Only,Intermediate,,
2213,Bear crawl donkey kick,"The bear crawl donkey kick is a more advanced version of the bear crawl exercise that adds a donkey kick. It adds an extra coordination and shoulder challenge to an already intense full-body movement that targets the cardiovascular system as well as a wide range of muscle groups, the shoulders, core, and legs in particular. It can be done as a full-body warm-up, in short bursts for power or circuit training, or for longer durations as cardiovascular conditioning.",Strength,Quadriceps,Body Only,Intermediate,,
2214,Southpaw sprawl with push-up,"The southpaw sprawl with push-up is a full-body movement that combines elements of a plank and a sprawl, with the addition of a push-up. It also has a rotational component, with a jumping leg-cross and torso twist in a straight-arm plank position. It is a challenging move that trains balance, core strength, and many muscle groups, making it work well in a time-efficient bodyweight circuit workout.",Strength,Quadriceps,Body Only,Intermediate,,
2215,Bouncing lunge,"The bouncing lunge is a bodyweight movement targeting the quads. It can be performed either for time or reps, and is often included as part of a fat-loss or athleticism-focused circuit workout.",Strength,Quadriceps,Body Only,Intermediate,,
2216,Bodyweight Squat - Gethin Variation,"The bodyweight squat is a fundamental exercise that strengthens the quads, glutes, and hamstrings. It can be performed as part of a dynamic warm-up, for time or reps during a workout, or for hip and spine mobility any time.",Strength,Quadriceps,Body Only,Intermediate,,
2217,FYR Alternating Lunge,"The forward lunge is a lower-body bodyweight exercise targeting the quads, glutes, and hamstrings. It can also be performed holding dumbbells or other weights. The forward lunge places more emphasis on the quads than other lunge variations. It can be performed for time or reps in the lower-body portion of any workout.",Strength,Quadriceps,Body Only,Intermediate,,
2218,Bodyweight Walking Lunge - Gethin Variation,"The walking lunge is a lower-body exercise that targets the glutes, quads, and hamstrings while challenging stability and balance. It can be performed for reps, time, or distance in the lower-body portion of any workout.",Strength,Quadriceps,Body Only,Intermediate,,
2219,Seated Quad Contraction,,Strength,Quadriceps,Body Only,Intermediate,,
2220,HM Squat with Alternating Leg Extension,,Strength,Quadriceps,Body Only,Intermediate,,
2221,HM Air Squat,,Strength,Quadriceps,Body Only,Intermediate,,
2222,HM Alternating Jump Lunge,,Strength,Quadriceps,Body Only,Intermediate,,
2223,HM Alternating Lunge-In-Place,,Strength,Quadriceps,Body Only,Intermediate,,
2224,HM Alternating Side Lunge,,Strength,Quadriceps,Body Only,Intermediate,,
2225,HM Sumo Pulse,,Strength,Quadriceps,Body Only,Intermediate,,
2226,HM Sumo Squat,,Strength,Quadriceps,Body Only,Intermediate,,
2227,HM Alternating Side-Kick,,Strength,Quadriceps,Body Only,Intermediate,,
2228,HM Tuck-Up Burpee,,Strength,Quadriceps,Body Only,Intermediate,,
2229,HM Bear Crawl,,Strength,Quadriceps,Body Only,Intermediate,,
2230,HM Bear Stance Fire Hydrant,,Strength,Quadriceps,Body Only,Intermediate,,
2231,HM Walking Frankenstein,,Strength,Quadriceps,Body Only,Intermediate,,
2232,HM Walking Hip Stretch,,Stretching,Quadriceps,Body Only,Intermediate,,
2233,HM Wide Jump Squat,,Strength,Quadriceps,Body Only,Intermediate,,
2234,HM Boxer Shuffle,,Strength,Quadriceps,Body Only,Intermediate,,
2235,HM Running Lunge,,Cardio,Quadriceps,Body Only,Intermediate,,
2236,HM Bulgarian Split Squat On Chair,,Strength,Quadriceps,Body Only,Intermediate,,
2237,HM Burpee,,Strength,Quadriceps,Body Only,Intermediate,,
2238,HM Butterfly,,Strength,Quadriceps,Body Only,Intermediate,,
2239,HM Alternating Lunge Push-Up,,Strength,Quadriceps,Body Only,Intermediate,,
2240,HM Comet,,Strength,Quadriceps,Body Only,Intermediate,,
2241,HM Couch Stretch,,Strength,Quadriceps,Body Only,Intermediate,,
2242,HM Down Up,,Strength,Quadriceps,Body Only,Intermediate,,
2243,HM Duck Walk,,Strength,Quadriceps,Body Only,Intermediate,,
2244,HM Fragon,,Strength,Quadriceps,Body Only,Intermediate,,
2245,HM Frankenstein,,Strength,Quadriceps,Body Only,Intermediate,,
2246,HM Single-Leg Squat on Chair,,Strength,Quadriceps,Body Only,Intermediate,,
2247,HM Single-Leg Touchdown,,Strength,Quadriceps,Body Only,Intermediate,,
2248,HM Speed Skater,,Strength,Quadriceps,Body Only,Intermediate,,
2249,HM Squat Jump,,Strength,Quadriceps,Body Only,Intermediate,,
2250,HM Squat Lunge,,Strength,Quadriceps,Body Only,Intermediate,,
2251,HM Garland Pose,,Strength,Quadriceps,Body Only,Intermediate,,
2252,HM High Knees,,Strength,Quadriceps,Body Only,Intermediate,,
2253,HM In-And-Out Squat,,Strength,Quadriceps,Body Only,Intermediate,,
2254,HM In-And-Out Squat Jump,,Strength,Quadriceps,Body Only,Intermediate,,
2255,HM Jumping Jack,,Strength,Quadriceps,Body Only,Intermediate,,
2256,HM Jumping Knee-Up,,Strength,Quadriceps,Body Only,Intermediate,,
2257,HM Jumping Rope,,Strength,Quadriceps,Body Only,Intermediate,,
2258,HM Right Calf-Spike Sumo Pulse,,Strength,Quadriceps,Body Only,Intermediate,,
2259,HM Reverse Lunge with Kick,,Strength,Quadriceps,Body Only,Intermediate,,
2260,HM Left Knee-Up,,Strength,Quadriceps,Body Only,Intermediate,,
2261,HM Left-Leg Lunge And Kick-Out,,Strength,Quadriceps,Body Only,Intermediate,,
2262,HM Mountain Pose,,Strength,Quadriceps,Body Only,Intermediate,,
2263,HM Butt Kickers,,Strength,Quadriceps,Body Only,Intermediate,,
2264,HM Right-Leg Lunge And Kick-Out,,Strength,Quadriceps,Body Only,Intermediate,,
2265,HM Sumo Get-Up,,Strength,Quadriceps,Body Only,Intermediate,,
2266,AM Jump Squat,"The jump squat is an explosive bodyweight exercise targeting the quads, hamstrings, and glutes. It is also a serious cardiovascular challenge when done for reps. It can be performed as a power exercise to build jumping power, or in any fat-loss or athleticism-focused workout.",Strength,Quadriceps,Body Only,Intermediate,,
2267,AM Bodyweight Squat,"The bodyweight squat is a fundamental exercise that strengthens the quads, glutes, and hamstrings. It can be performed as part of a dynamic warm-up, for time or reps during a workout, or for hip and spine mobility any time.",Strength,Quadriceps,Body Only,Intermediate,,
2268,High knees sprawl drill,"The high knees sprawl drill is a full-body, cardio and strength-focused exercise. It can be performed for reps or time in a fast-paced circuit or other workout.",Strength,Quadriceps,Body Only,Intermediate,,
2269,UP Bulgarian Split Squat,"The dumbbell Bulgaria split squat is a single-leg exercise targeting the quads, glutes, and hamstrings.",Strength,Quadriceps,Body Only,Intermediate,,
2270,UN Forward Lunge,,Strength,Quadriceps,Body Only,Intermediate,,
2271,UN Front Foot Elevated Split Squat,,Strength,Quadriceps,Body Only,Intermediate,,
2272,UNS Half-Kneeling Hip Flexor Stretch,,Strength,Quadriceps,Body Only,Intermediate,,
2273,UNS Low Depth Jump,,Strength,Quadriceps,Body Only,Intermediate,,
2274,UNS Forward-To-Reverse Lunge,,Strength,Quadriceps,Body Only,Intermediate,,
2275,Holman Towel Squat Thrust,,Strength,Quadriceps,Body Only,Intermediate,,
2276,Holman Towel Alternating Prisoner Squat,,Strength,Quadriceps,Body Only,Intermediate,,
2277,Holman Towel Alternating Lateral Lunge,,Strength,Quadriceps,Body Only,Intermediate,,
2278,Holman Squat Pull-Through Jump,,Strength,Quadriceps,Body Only,Intermediate,,
2279,Holman 180 Jump,,Strength,Quadriceps,Body Only,Intermediate,,
2280,Holman Foot-Elevated Knee-Up to Squat,,Strength,Quadriceps,Body Only,Intermediate,,
2281,Holman Feet-Elevated Squat Thrust,,Strength,Quadriceps,Body Only,Intermediate,,
2282,Holman Hands-Elevated Lunge Jump,,Strength,Quadriceps,Body Only,Intermediate,,
2283,Holman Hands-Elevated Jack to Split Jump,,Strength,Quadriceps,Body Only,Intermediate,,
2284,Holman Hands-Elevated Wide Squat Thrust,,Strength,Quadriceps,Body Only,Intermediate,,
2285,Holman Hands-Elevated Squat Thrust to Split Jack,,Strength,Quadriceps,Body Only,Intermediate,,
2286,Holman Squat Jump,,Strength,Quadriceps,Body Only,Intermediate,,
2287,Holman Squat Pulse,,Strength,Quadriceps,Body Only,Intermediate,,
2288,Holman Jump-Out Push-Up,,Strength,Quadriceps,Body Only,Intermediate,,
2289,Holman Alternating Forward Lunge,,Strength,Quadriceps,Body Only,Intermediate,,
2290,Holman Burpee to Jump,,Strength,Quadriceps,Body Only,Intermediate,,
2291,Holman Pilates Single-Leg Stretch,,Strength,Quadriceps,Body Only,Intermediate,,
2292,Holman Alternating Reverse Prisoner Lunge,,Strength,Quadriceps,Body Only,Intermediate,,
2293,Holman Narrow-Wide Squat Jump to 180 Jump,,Strength,Quadriceps,Body Only,Intermediate,,
2294,Holman 180 Jump to Lunge,,Strength,Quadriceps,Body Only,Intermediate,,
2295,Holman Imaginary Jump Rope,,Strength,Quadriceps,Body Only,Intermediate,,
2296,Holman Fast Feet with Hands Up,,Strength,Quadriceps,Body Only,Intermediate,,
2297,Holman Hands-Elevated Alternating Lunge Jump,,Strength,Quadriceps,Body Only,Intermediate,,
2298,Holman Right Split Lunge,,Strength,Quadriceps,Body Only,Intermediate,,
2299,Holman Left Split Lunge,,Strength,Quadriceps,Body Only,Intermediate,,
2300,Holman Plyometric Jump,,Strength,Quadriceps,Body Only,Intermediate,,
2301,Holman Quad Touch Jump,,Strength,Quadriceps,Body Only,Intermediate,,
2302,Holman Skate,,Strength,Quadriceps,Body Only,Intermediate,,
2303,Holman Lunge Jump,,Strength,Quadriceps,Body Only,Intermediate,,
2304,Holman Flying Squat Thrust,,Strength,Quadriceps,Body Only,Intermediate,,
2305,Holman 90-Degree Jump,,Strength,Quadriceps,Body Only,Intermediate,,
2306,Holman Half Jack to 180 Jump,,Strength,Quadriceps,Body Only,Intermediate,,
2307,Holman Quick Feet to Quad Touch Jump,,Strength,Quadriceps,Body Only,Intermediate,,
2308,Holman Squat Thrust to Push-Up to Super Woman,,Strength,Quadriceps,Body Only,Intermediate,,
2309,Holman Plyometric Jump to 180 Jump,,Strength,Quadriceps,Body Only,Intermediate,,
2310,Holman Standing Heel Click to Hands Down Heel Click,,Strength,Quadriceps,Body Only,Intermediate,,
2311,Holman Burpee to 180 Jump,,Strength,Quadriceps,Body Only,Intermediate,,
2312,Holman Traveling Low Jack to Belly Touch,,Strength,Quadriceps,Body Only,Intermediate,,
2313,Holman Flying Squat Thrust to Shoulder Tap,,Strength,Quadriceps,Body Only,Intermediate,,
2314,Holman Squat Jump to Alternating Side Lunge Jump,,Strength,Quadriceps,Body Only,Intermediate,,
2315,Holman Low Squat with Low Diagonal Dumbbell Punch,,Strength,Quadriceps,Body Only,Intermediate,,
2316,Holman Right Leg Hop to Right Reverse Lunge,,Strength,Quadriceps,Body Only,Intermediate,,
2317,Holman Left Leg Hop to Left Reverse Lunge,,Strength,Quadriceps,Body Only,Intermediate,,
2318,Holman Burpee to Open Stance,,Strength,Quadriceps,Body Only,Intermediate,,
2319,Holman Diagonal Squat Thrust to Renegade Forward Punch,,Strength,Quadriceps,Body Only,Intermediate,,
2320,Holman Bear Crawl,,Strength,Quadriceps,Body Only,Intermediate,,
2321,Holman Bear Crawl to Donkey Kick,,Strength,Quadriceps,Body Only,Intermediate,,
2322,Holman Bear Crawl to Froggy Push-Up,,Strength,Quadriceps,Body Only,Intermediate,,
2323,Holman Bear Crawl to Shoulder Tap,,Strength,Quadriceps,Body Only,Intermediate,,
2324,Holman Burpee to Tuck Jump,,Strength,Quadriceps,Body Only,Intermediate,,
2325,Holman Burpee to Flying Squat Thrust to Tuck Jump,,Strength,Quadriceps,Body Only,Intermediate,,
2326,Holman Forward Lunge to Reverse Lunge,,Strength,Quadriceps,Body Only,Intermediate,,
2327,Holman Renegade Lunge Jump,,Strength,Quadriceps,Body Only,Intermediate,,
2328,Holman Squat Jump to Lunge Jump,,Strength,Quadriceps,Body Only,Intermediate,,
2329,Holman Prisoner Reverse Lunge,,Strength,Quadriceps,Body Only,Intermediate,,
2330,Holman Wide-to-Narrow Squat Jump,,Strength,Quadriceps,Body Only,Intermediate,,
2331,Holman Donkey Run,,Strength,Quadriceps,Body Only,Intermediate,,
2332,Holman Weighted Wide-to-Narrow Squat Jump,,Strength,Quadriceps,Body Only,Intermediate,,
2333,Holman Wide-to-Narrow Donkey Kick,,Strength,Quadriceps,Body Only,Intermediate,,
2334,Holman Mule Kick,,Strength,Quadriceps,Body Only,Intermediate,,
2335,Holman Goal Post to Squat,,Strength,Quadriceps,Body Only,Intermediate,,
2336,Holman Frogger Squat to Heel Click,,Strength,Quadriceps,Body Only,Intermediate,,
2337,Holman Stair Sprint,,Strength,Quadriceps,Body Only,Intermediate,,
2338,Holman Stair Bear Crawl,,Strength,Quadriceps,Body Only,Intermediate,,
2339,Holman Burpee to Flying Squat Thrust,,Strength,Quadriceps,Body Only,Intermediate,,
2340,Holman Flying Squat Thrust to Push-Up,,Strength,Quadriceps,Body Only,Intermediate,,
2341,Holman Foot-Elevated Step-To-Lunge,,Strength,Quadriceps,Body Only,Intermediate,,
2342,Holman Split Lunge,,Strength,Quadriceps,Body Only,Intermediate,,
2343,Holman Stair Climb,,Strength,Quadriceps,Body Only,Intermediate,,
2344,Holman Burpee to Flying Jack,,Strength,Quadriceps,Body Only,Intermediate,,
2345,Holman Right Reverse Lunge,,Strength,Quadriceps,Body Only,Intermediate,,
2346,Holman Left Reverse Lunge,,Strength,Quadriceps,Body Only,Intermediate,,
2347,Holman Squat Tap to Hop,,Strength,Quadriceps,Body Only,Intermediate,,
2348,Holman Squat Tap to Jump-Forward-Jump-Back,,Strength,Quadriceps,Body Only,Intermediate,,
2349,Holman Squat Hip Drive,,Strength,Quadriceps,Body Only,Intermediate,,
2350,Holman Alternating Double Lunge Hop,,Strength,Quadriceps,Body Only,Intermediate,,
2351,Holman Right Reverse Lunge to Front Kick,,Strength,Quadriceps,Body Only,Intermediate,,
2352,Holman Right Leg Forward Lunge Hop,,Strength,Quadriceps,Body Only,Intermediate,,
2353,Holman Right Squat Thrust,,Strength,Quadriceps,Body Only,Intermediate,,
2354,Holman Left Reverse Lunge to Front Kick,,Strength,Quadriceps,Body Only,Intermediate,,
2355,Holman Left Leg Forward Lunge Hop,,Strength,Quadriceps,Body Only,Intermediate,,
2356,Holman Left Side Diagonal Burpee,,Strength,Quadriceps,Body Only,Intermediate,,
2357,Holman Left Squat Thrust,,Strength,Quadriceps,Body Only,Intermediate,,
2358,Holman Wide Squat Thrust,,Strength,Quadriceps,Body Only,Intermediate,,
2359,Holman Alternating Single-Leg Hop to Squat to 180 Jump,,Strength,Quadriceps,Body Only,Intermediate,,
2360,Holman Right Lunge Hop to Chest Press,,Strength,Quadriceps,Body Only,Intermediate,,
2361,Holman Left Lunge Hop to Overhead Press,,Strength,Quadriceps,Body Only,Intermediate,,
2362,Holman 180 Jump Hop Forward Hop Back,,Strength,Quadriceps,Body Only,Intermediate,,
2363,Holman Right Split Squat,,Strength,Quadriceps,Body Only,Intermediate,,
2364,Holman Left Split Squat,,Strength,Quadriceps,Body Only,Intermediate,,
2365,Holman Double Squat Pulse to 180 Jump,,Strength,Quadriceps,Body Only,Intermediate,,
2366,Holman Towel Left Side Squat,,Strength,Quadriceps,Body Only,Intermediate,,
2367,Holman Alternating Lunge Jump,,Strength,Quadriceps,Body Only,Intermediate,,
2368,Holman Lunge Jump to Squat Jump,,Strength,Quadriceps,Body Only,Intermediate,,
2369,Holman Burpee with Belly Touch,,Strength,Quadriceps,Body Only,Intermediate,,
2370,Bootstrapper squat,"The bootstrapper squat is a movement that improves mobility, muscular strength, and flexibility in the hips and hamstrings. It is usually performed as part of a dynamic warm-up for the lower body to mobilize the hips and improve squat form.",Strength,Quadriceps,Body Only,Intermediate,,
2371,Total Fitness Broad Jump,"The broad jump is an explosive lower-body exercise. It is a common way to measure explosive hip and lower-body strength in athletes. The more explosive you are, the farther you'll be able to jump.",Strength,Quadriceps,Body Only,Intermediate,,
2372,Total Fitness Lateral Lunge,"The lateral lunge is a lower-body bodyweight movement that works the quads, glutes, and hamstrings. It can also be performed holding dumbbells or other weights. It is often performed for reps as part of a dynamic warm-up or mobility routine but can also work in a circuit or other workouts.",Strength,Quadriceps,Body Only,Intermediate,,
2373,Lateral shuffle,"The lateral shuffle is a common exercise in sports training and gym classes. It involves taking steps to one side and then steps to the other side. It can be performed as part of a circuit for athletes of any level, but is also a great movement for beginners.",Strength,Quadriceps,Body Only,Intermediate,,
2374,Total Fitness Skip,"The skip is an exercise that builds power and explosiveness in the legs. It's commonly performed by children and in gym classes, but is also great for working the legs and hip flexors, making it a favorite warm-up for athletes who need to explode vertically.",Strength,Quadriceps,Body Only,Intermediate,,
2375,Total Fitness Spider Lunge,"The spider lunge stretch is a lower-body stretch targeting the hips, groin, and quads. It can be part of a dynamic warm-up or mobility work performed anytime.",Strength,Quadriceps,Body Only,Intermediate,,
2376,Spider lunge stretch,"The spider lunge stretch is a lower-body stretch targeting the hips, groin, and quads. It can be part of a dynamic warm-up or mobility work performed anytime.",Strength,Quadriceps,Body Only,Intermediate,,
2377,Spider lunge with T-rotation,"The spider lunge with T-rotation is an exercise that produces a deep stretch in the glutes and hamstrings while also rotating and mobilizing the thoracic spine region. It is a great movement to include in a dynamic warm-up, or as mobility work anytime.",Strength,Quadriceps,Body Only,Intermediate,,
2378,Standing quad stretch,"The standing quad stretch is a simple exercise designed to stretch the quadriceps, the big muscles that cover most of the thighs. This is a static stretch, meaning it’s usually performed by holding the stretched position for a certain length of time.",Strength,Quadriceps,Body Only,Intermediate,,
2379,Vertical jump,"The vertical jump is an explosive lower-body exercise that is a common way to measure explosive hip and lower-body strength in athletes. The more explosive you are, the higher you'll be able to jump.",Strength,Quadriceps,Body Only,Intermediate,,
2380,King Maker Burpee,"The burpee is a high-intensity exercise that recruits the entire body to build strength and aerobic capacity. It is common in CrossFit workouts and group fitness classes, but can also be performed for time or reps in any fat-loss or athleticism-focused circuit or workout.",Strength,Quadriceps,Body Only,Intermediate,,
2381,King Maker Explosive High Jump,"The tuck jump is a vertical jump, an explosive lower-body exercise that is a common way to measure explosive hip and lower-body strength in athletes. The more explosive you are, the higher you'll be able to jump.",Strength,Quadriceps,Body Only,Intermediate,,
2382,Muscle Beach Skip,,Strength,Quadriceps,Body Only,Intermediate,,
2383,Muscle Beach Broad Jump,,Strength,Quadriceps,Body Only,Intermediate,,
2384,Muscle Beach Sprint,,Strength,Quadriceps,Body Only,Intermediate,,
2385,Muscle Beach Front Kick,,Strength,Quadriceps,Body Only,Intermediate,,
2386,Muscle Beach Side Kick,,Strength,Quadriceps,Body Only,Intermediate,,
2387,Muscle Beach Spin Kick,,Strength,Quadriceps,Body Only,Intermediate,,
2388,Muscle Beach Freestyle Kick,,Strength,Quadriceps,Body Only,Intermediate,,
2389,MetaBurn Alternating Curtsy Lunge To Squat,,Strength,Quadriceps,Body Only,Intermediate,,
2390,MetaBurn Alternating Curtsy Lunge With High Knee,,Strength,Quadriceps,Body Only,Intermediate,,
2391,MetaBurn Alternating Diagonal Sprawl,,Strength,Quadriceps,Body Only,Intermediate,,
2392,MetaBurn Alternating Lateral Sprawl,,Strength,Quadriceps,Body Only,Intermediate,,
2393,MetaBurn Curtsy Lunge,,Strength,Quadriceps,Body Only,Intermediate,,
2394,MetaBurn Frogger,,Strength,Quadriceps,Body Only,Intermediate,,
2395,MetaBurn High Knee Rotation,,Strength,Quadriceps,Body Only,Intermediate,,
2396,MetaBurn Side-To-Side Lunge,,Strength,Quadriceps,Body Only,Intermediate,,
2397,MetaBurn Star Jump,,Strength,Quadriceps,Body Only,Intermediate,,
2398,MetaBurn Tuck Jump With Knee Slap,,Strength,Quadriceps,Body Only,Intermediate,,
2399,MetaBurn Lateral Bounding Hop,,Strength,Quadriceps,Body Only,Intermediate,,
2400,MetaBurn Double Lunge,,Strength,Quadriceps,Body Only,Intermediate,,
2401,Robertson Sprinter Step-Up,,Strength,Quadriceps,Body Only,Intermediate,,
2402,FYR2 Front Kick-Through,,Strength,Quadriceps,Body Only,Intermediate,,
2403,Lunge high-knee clap,"The lunge high-knee clap is a full-body, cardio-based exercise with emphasis on the lower body. It includes a clap under the front leg to make the movement more powerful and strict. It can be performed either for time or reps and is a great inclusion in a fat-loss or athleticism-focused circuit workout.",Strength,Quadriceps,Body Only,Intermediate,,
2404,FYR2 Plyo Split Squat,,Strength,Quadriceps,Body Only,Intermediate,,
2405,FYR2 Reverse Burpee,,Strength,Quadriceps,Body Only,Intermediate,,
2406,FYR2 Reverse Burpee to Regular Burpee,,Strength,Quadriceps,Body Only,Intermediate,,
2407,FYR2 Reverse Burpee Tuck Jump,,Strength,Quadriceps,Body Only,Intermediate,,
2408,FYR2 Sprawlee,,Strength,Quadriceps,Body Only,Intermediate,,
2409,FYR2 Squat Hold,,Strength,Quadriceps,Body Only,Intermediate,,
2410,FYR2 Squat Jump,,Strength,Quadriceps,Body Only,Intermediate,,
2411,FYR2 Squat Pulse,,Strength,Quadriceps,Body Only,Intermediate,,
2412,Sprinter burpee,The sprinter burpee is an explosive version of the burpee exercise that adds a sprinter jump to the top of each rep. It can be performed for time or reps in any fat-loss or athleticism-focused circuit or workout.,Strength,Quadriceps,Body Only,Intermediate,,
2413,Shuttle run training,"Shuttle run training is an athletic conditioning drill that’s great for developing speed and power, as well as changing direction. It’s a favorite of football and basketball players, but it can also be great conditioning work for lifters and athletes of all ability levels.",Strength,Quadriceps,Body Only,Intermediate,,
